<?xml version='1.0' encoding='UTF-8'?>
<Manifest xmlns="urn:storm:1.0" xmlns:xsi="http://www.w3.org/2001/XMLSchema-instance" schemaversie="0.6.0" xsi:schemaLocation="urn:storm:1.0 https://raw.githubusercontent.com/RicharddeGraaf1/Storm/main/standaard/xsd/storm-volledig.xsd">
  <regeling ref="/akn/nl/act/gm0297/2019/reg456"/>
  <doel>/join/id/proces/gm0297/2019/Instelling</doel>
  <Bestand naam="storm-volledig.xml" rol="regeling" contentType="application/xml"/>
  <Bestand naam="Bedrijf_categorie_2.storm-gio.xml" rol="gio" contentType="application/xml" work="/join/id/regdata/gm0297/2019/Bedrijf_categorie_2"/>
  <Bestand naam="Centrumgebied.storm-gio.xml" rol="gio" contentType="application/xml" work="/join/id/regdata/gm0297/2019/Centrumgebied"/>
  <Bestand naam="Zone_A.storm-gio.xml" rol="gio" contentType="application/xml" work="/join/id/regdata/gm0297/2019/Zone_A"/>
  <Bestand naam="Zone_B.storm-gio.xml" rol="gio" contentType="application/xml" work="/join/id/regdata/gm0297/2019/Zone_B"/>
  <Bestand naam="Speelhal.storm-gio.xml" rol="gio" contentType="application/xml" work="/join/id/regdata/gm0297/2019/Speelhal"/>
  <Bestand naam="Bouwhoogte.storm-gio.xml" rol="gio" contentType="application/xml" work="/join/id/regdata/gm0297/2019/Bouwhoogte"/>
  <Bestand naam="Welstand.storm-gio.xml" rol="gio" contentType="application/xml" work="/join/id/regdata/gm0297/2019/Welstand"/>
  <Bestand naam="Zuilichem.storm-gio.xml" rol="gio" contentType="application/xml" work="/join/id/regdata/gm0297/2019/Zuilichem"/>
  <Bestand naam="PonsGebied.storm-gio.xml" rol="gio" contentType="application/xml" work="/join/id/regdata/gm0297/2021/Ponsgebied"/>
</Manifest>
